{
  "$schema": "https://raw.githubusercontent.com/russoedu/open.craw/main/packages/core/schemas/output-recipe.schema.json",
  "kind": "output",
  "id": "quote",
  "version": 1,
  "fields": {
    "text": { "type": "string", "required": true, "key": true },
    "author": { "type": "string", "required": true },
    "goodreads": { "type": "url", "nullable": true },
    "pageUrl": { "type": "url" },
    "page": { "type": "integer" }
  }
}
