{
  "$schema": "https://raw.githubusercontent.com/Open-Craw/OpenCraw/main/packages/core/schemas/output-recipe.schema.json",
  "kind": "output",
  "id": "quote-tags",
  "version": 1,
  "fields": {
    "author": { "type": "string", "required": true },
    "tagCount": { "type": "integer" },
    "tagsSoFar": { "type": "integer" }
  }
}
