{
  "$schema": "https://raw.githubusercontent.com/Open-Craw/OpenCraw/main/packages/core/schemas/output-recipe.schema.json",
  "kind": "output",
  "id": "quotes-page",
  "version": 1,
  "fields": {
    "apiPage": { "type": "integer", "required": true, "key": true },
    "pageNumber": { "type": "integer" },
    "url": { "type": "url" },
    "quotes": { "type": "integer" },
    "hasNext": { "type": "boolean" }
  }
}
