{
  "$schema": "https://raw.githubusercontent.com/Open-Craw/OpenCraw/main/packages/core/schemas/output-recipe.schema.json",
  "kind": "output",
  "id": "quote",
  "version": 1,
  "fields": {
    "text": { "type": "string", "required": true, "key": true },
    "author": { "type": "string", "required": true },
    "tags": { "type": "array", "items": { "type": "string" } }
  }
}
