{
  "$schema": "https://raw.githubusercontent.com/Open-Craw/OpenCraw/main/packages/core/schemas/output-recipe.schema.json",
  "kind": "output",
  "id": "catalogue-page",
  "version": 1,
  "fields": {
    "page": { "type": "integer", "required": true, "key": true },
    "url": { "type": "url" },
    "pager": { "type": "string" },
    "books": { "type": "integer" },
    "firstTitle": { "type": "string" }
  }
}
