{
  "$schema": "https://raw.githubusercontent.com/russoedu/open.craw/main/packages/core/schemas/output-recipe.schema.json",
  "kind": "output",
  "id": "tagged-quote",
  "version": 1,
  "fields": {
    "text": { "type": "string", "required": true, "key": true },
    "author": { "type": "string", "required": true },
    "label": { "type": "string" },
    "firstTag": { "type": "string", "nullable": true }
  }
}
